post_url,author,post_title,comments,upvotes,subreddit_name,subreddit_link,search_terms
https://www.reddit.com/r/learnpython/comments/12epj8d/beautiful_soup_getting_an_empty_list_when_using/,,"Beautiful soup, getting an empty list when using find_all method",14,2,r/learnpython,https://www.reddit.com/r/learnpython/,"['selenium', 'beautifulsoup']"
https://www.reddit.com/r/developersIndia/comments/12d8r52/would_like_someone_to_review_my_resume_from_ats/,https://www.reddit.com/user/AdCapable9122/,Would like someone to review my resume from ATS perspective. Also looking out for jobs matching my profile. Do let me know if there are any leads.,1,2,r/developersIndia,https://www.reddit.com/r/developersIndia/,"['selenium', 'beautifulsoup']"
https://www.reddit.com/r/pythontips/comments/12csrzv/help_request_prime_video_watchlist_scraper/,https://www.reddit.com/user/MonkeyOps53/,Help Request: Prime Video Watchlist Scraper,0,2,r/pythontips,https://www.reddit.com/r/pythontips/,"['selenium', 'beautifulsoup']"
https://www.reddit.com/r/slavelabour/comments/12alhf5/offershopify_theme_development_and_web_scraping/,https://www.reddit.com/user/Trobis/,[OFFER]Shopify Theme Development and web scraping and python scripting.,5,1,r/slavelabour,https://www.reddit.com/r/slavelabour/,"['selenium', 'beautifulsoup']"
https://www.reddit.com/r/learnpython/comments/129w3zx/is_my_idea_possible_creating_an_ai/,https://www.reddit.com/user/IcyPresentation1536/,Is my idea possible? Creating an AI.,4,0,r/learnpython,https://www.reddit.com/r/learnpython/,"['selenium', 'beautifulsoup']"
https://www.reddit.com/r/webscraping/comments/129dawn/confused_about_selenium_and_also_curl/,,Confused about Selenium and also CURL,3,0,r/webscraping,https://www.reddit.com/r/webscraping/,"['selenium', 'beautifulsoup']"
https://www.reddit.com/r/programacao/comments/128t0oc/me_ajudaaaaa/,https://www.reddit.com/user/Ok_Home_4400/,ME AJUDAAAAA,4,0,r/programacao,https://www.reddit.com/r/programacao/,"['selenium', 'beautifulsoup']"
https://www.reddit.com/r/learnpython/comments/128rxlo/i_need_help_with_filewrite_and_removing_a_column/,https://www.reddit.com/user/k3yb0ardCowboy/,I need help with file.write() and removing a column of dates from being saved to csv,5,0,r/learnpython,https://www.reddit.com/r/learnpython/,"['selenium', 'beautifulsoup']"
https://www.reddit.com/r/learnpython/comments/1224hjf/can_requests_be_used_to_make_a_call_to_a_js/,https://www.reddit.com/user/Money_Wafer_8292/,Can Requests be used to make a call to a js script? Need some guidance.,5,0,r/learnpython,https://www.reddit.com/r/learnpython/,"['selenium', 'beautifulsoup']"
https://www.reddit.com/user/actowiz/comments/11x99k8/how_to_scrape_amazon_ppc_ad_data_in_realtime_and/,https://www.reddit.com/user/actowiz/,How to Scrape Amazon PPC AD Data in Real-Time and Completely Free?,0,1,u/actowiz,https://www.reddit.com/user/actowiz/,"['selenium', 'beautifulsoup']"
https://www.reddit.com/r/webscraping/comments/11oltsv/beautifulsoup_scraping_only_first_few_lines_of/,https://www.reddit.com/user/adithyab14/,beautifulsoup scraping only first few lines of content,10,0,r/webscraping,https://www.reddit.com/r/webscraping/,"['selenium', 'beautifulsoup']"
https://www.reddit.com/r/learnpython/comments/11nc0wl/im_stuck_on_web_scraping_dont_know_what_the_issue/,https://www.reddit.com/user/runnershigh1990/,I'm stuck on web scraping / don't know what the issue is,5,2,r/learnpython,https://www.reddit.com/r/learnpython/,"['selenium', 'beautifulsoup']"
https://www.reddit.com/r/programminghelp/comments/11l86oc/help_with_web_scraping_to_create_a_small_books/,https://www.reddit.com/user/Marvellover13/,"help with web scraping to create a small books database in python, and formatting a CVS file in python as well?",0,2,r/programminghelp,https://www.reddit.com/r/programminghelp/,"['selenium', 'beautifulsoup']"
https://www.reddit.com/r/DoneDirtCheap/comments/11k1dbm/offeri_will_help_scrape_websites_for_data_and/,https://www.reddit.com/user/Trobis/,[OFFER]I will help scrape websites for data and python scripting.,2,2,r/DoneDirtCheap,https://www.reddit.com/r/DoneDirtCheap/,"['selenium', 'beautifulsoup']"
https://www.reddit.com/r/learnpython/comments/11icw46/handling_dynamic_table_reloading_after_next_page/,https://www.reddit.com/user/throwawayrandomvowel/,Handling dynamic table re-loading after next page,3,2,r/learnpython,https://www.reddit.com/r/learnpython/,"['selenium', 'beautifulsoup']"
https://www.reddit.com/r/webscraping/comments/11h2b1z/noob_here_looking_for_some_tips_on_this_code_for/,https://www.reddit.com/user/Marvellover13/,"noob here, looking for some tips on this code for optimization if there's any need.",14,2,r/webscraping,https://www.reddit.com/r/webscraping/,"['selenium', 'beautifulsoup']"
https://www.reddit.com/r/slavelabour/comments/11gar6t/offershopify_theme_development_and_web_scraping/,https://www.reddit.com/user/Trobis/,[OFFER]Shopify Theme Development and web scraping and python scripting.,2,1,r/slavelabour,https://www.reddit.com/r/slavelabour/,"['selenium', 'beautifulsoup']"
https://www.reddit.com/r/learnpython/comments/11fq5nr/does_anyone_know_what_this_error_is_and_how_i_can/,https://www.reddit.com/user/runnershigh1990/,Does anyone know what this error is and how I can rectify? I'm trying to web scrap,5,0,r/learnpython,https://www.reddit.com/r/learnpython/,"['selenium', 'beautifulsoup']"
https://www.reddit.com/r/selenium/comments/11fkmdg/unable_to_retrieve_new_html_code_after_clicking/,https://www.reddit.com/user/Itchy-Computer3903/,Unable to retrieve new html code after clicking next button using selenium. URL doesn't change as well,8,3,r/selenium,https://www.reddit.com/r/selenium/,"['selenium', 'beautifulsoup']"
https://www.reddit.com/r/selenium/comments/11f4qv3/data_scraping_and_i_get_this_problem_were_sorry/,https://www.reddit.com/user/Itchy-Computer3903/,Data scraping and I get this problem: We're sorry but viewer-app doesn't work properly without JavaScript enabled. Please enable it to continue,3,3,r/selenium,https://www.reddit.com/r/selenium/,"['selenium', 'beautifulsoup']"
https://www.reddit.com/r/learnprogramming/comments/118turm/trying_to_build_a_web_scraping_bot_but_i_keep/,https://www.reddit.com/user/ConvictedReaper/,"Trying to build a web scraping bot, but I keep getting ""unable to find element""",5,5,r/learnprogramming,https://www.reddit.com/r/learnprogramming/,"['selenium', 'beautifulsoup']"
https://www.reddit.com/r/learnprogramming/comments/116aits/how_do_i_download_html_as_it_looks_in_my_browser/,https://www.reddit.com/user/Cold-Hearted-Bastard/,How do I download HTML as it looks in my browser?,1,1,r/learnprogramming,https://www.reddit.com/r/learnprogramming/,"['selenium', 'beautifulsoup']"
https://www.reddit.com/r/webscraping/comments/115iume/i_try_to_scrap_seeking_alpha_articles/,https://www.reddit.com/user/cheapnessltd/,I try to scrap Seeking alpha articles,0,1,r/webscraping,https://www.reddit.com/r/webscraping/,"['selenium', 'beautifulsoup']"
https://www.reddit.com/r/learnpython/comments/114ueza/i_cant_scrape_imdb/,https://www.reddit.com/user/gbosah/,I can't scrape imdb,2,0,r/learnpython,https://www.reddit.com/r/learnpython/,"['selenium', 'beautifulsoup']"
https://www.reddit.com/r/resumes/comments/113rpp8/would_appreciate_some_feedback_from_india/,https://www.reddit.com/user/Raggs04/,"Would appreciate some feedback. From India specifically, in my notice period and my new job offer was just pulled.",2,1,r/resumes,https://www.reddit.com/r/resumes/,"['selenium', 'beautifulsoup']"
https://www.reddit.com/r/slavelabour/comments/111d9i6/offeri_will_help_scrape_websites_for_data_and/,https://www.reddit.com/user/Trobis/,[OFFER]I will help scrape websites for data and python scripting.,1,1,r/slavelabour,https://www.reddit.com/r/slavelabour/,"['selenium', 'beautifulsoup']"
https://www.reddit.com/r/webscraping/comments/110ha2v/website_behind_cloudflare_and_user_logon/,https://www.reddit.com/user/MedicalFish9200/,Website behind cloudflare and user logon,4,5,r/webscraping,https://www.reddit.com/r/webscraping/,"['selenium', 'beautifulsoup']"
https://www.reddit.com/user/Seosprint/comments/10v06kx/development_of_a_parser_in_python_to_receive_any/,https://www.reddit.com/user/Seosprint/,Development of a Parser in Python to Receive Any Data from Sites,0,2,u/Seosprint,https://www.reddit.com/user/Seosprint/,"['selenium', 'beautifulsoup']"
https://www.reddit.com/r/replit/comments/10rq6tc/does_anyone_know_how_to_fix_this_error_i_am/,,Does anyone know how to fix this error? I am trying to webscrape and get top 50 passing yard leaders of all time in nfl history but I keep getting this error,2,0,r/replit,https://www.reddit.com/r/replit/,"['selenium', 'beautifulsoup']"
https://www.reddit.com/r/ChatGPT/comments/10qavkk/revolutionizing_twitter_analytics_with_gpt3_check/,https://www.reddit.com/user/Traditional-Drop4922/,Revolutionizing Twitter Analytics with GPT-3: Check Out My ChatGPT-powered Twitter Comment Analyzer Repo,1,1,r/ChatGPT,https://www.reddit.com/r/ChatGPT/,"['selenium', 'beautifulsoup']"
https://www.reddit.com/r/ChatGPT/comments/10ohegg/best_dan_conversation_yet_for_me/,https://www.reddit.com/user/cyberunicorn2020/,Best DAN conversation yet for me,1,2,r/ChatGPT,https://www.reddit.com/r/ChatGPT/,"['selenium', 'beautifulsoup']"
https://www.reddit.com/r/IWantOut/comments/10k26b6/iwantout_27m_usa_japan/,,[IWantOut] 27M USA -> Japan,51,41,r/IWantOut,https://www.reddit.com/r/IWantOut/,"['selenium', 'beautifulsoup']"
https://www.reddit.com/r/slavelabour/comments/10j6qyw/offeri_will_help_scrape_websites_for_data_and/,https://www.reddit.com/user/Trobis/,[OFFER]I will help scrape websites for data and python scripting.,1,5,r/slavelabour,https://www.reddit.com/r/slavelabour/,"['selenium', 'beautifulsoup']"
https://www.reddit.com/r/learnpython/comments/10hfz86/im_trying_to_make_a_web_scraper_for_the_site/,https://www.reddit.com/user/TheHunter920/,"I'm trying to make a web scraper for the site rpilocator.com without Selenium, but here are the issues I'm running into:",6,1,r/learnpython,https://www.reddit.com/r/learnpython/,"['selenium', 'beautifulsoup']"
https://www.reddit.com/r/resumes/comments/10ey8ou/seeking_advice_to_get_an_entry_level_job_in_data/,https://www.reddit.com/user/lohessabb/,Seeking advice to get an entry level job in data science,1,7,r/resumes,https://www.reddit.com/r/resumes/,"['selenium', 'beautifulsoup']"
https://www.reddit.com/r/webscraping/comments/10el6kb/which_course_is_better_for_web_parsing/,https://www.reddit.com/user/NikitaQuinn/,Which course is better for web parsing?,5,4,r/webscraping,https://www.reddit.com/r/webscraping/,"['selenium', 'beautifulsoup']"
https://www.reddit.com/r/progether/comments/10dt7xe/im_in_london_do_you_want_to_progether_in_python/,https://www.reddit.com/user/eric777777777/,I'm in London - do you want to Progether in Python something based on Data & related to Finance & Fundraising?,6,2,r/progether,https://www.reddit.com/r/progether/,"['selenium', 'beautifulsoup']"
https://www.reddit.com/r/selenium/comments/10dpl7k/hard_time_populating_the_find_elements_function/,https://www.reddit.com/user/No_Assignment_8590/,Hard time populating the find_elements function.,8,3,r/selenium,https://www.reddit.com/r/selenium/,"['selenium', 'beautifulsoup']"
https://www.reddit.com/r/dataanalysis/comments/10d8j1t/i_have_been_applying_for_remote_data_analyst/,https://www.reddit.com/user/Longjumping_Guess_57/,I have been applying for remote Data analyst Internship position since last month but getting no response.,31,14,r/dataanalysis,https://www.reddit.com/r/dataanalysis/,"['selenium', 'beautifulsoup']"
https://www.reddit.com/r/developersIndia/comments/zzpg2f/reviewroast_my_resume_please_day_2/,https://www.reddit.com/user/theLaw1730/,Review(/roast) my resume please. [Day 2],8,8,r/developersIndia,https://www.reddit.com/r/developersIndia/,"['selenium', 'beautifulsoup']"
https://www.reddit.com/r/learnpython/comments/zz9bqn/how_to_stop_selenium_scrape_after_final_page/,https://www.reddit.com/user/overcomingnes/,How To Stop Selenium Scrape After Final Page Pagination?,0,1,r/learnpython,https://www.reddit.com/r/learnpython/,"['selenium', 'beautifulsoup']"
https://www.reddit.com/r/developersIndia/comments/zywie4/reviewroast_my_resume_please/,https://www.reddit.com/user/theLaw1730/,Review(/roast) my resume please.,2,0,r/developersIndia,https://www.reddit.com/r/developersIndia/,"['selenium', 'beautifulsoup']"
https://www.reddit.com/r/webscraping/comments/zydznc/scraping_javascript_based_website/,https://www.reddit.com/user/Jason_hill100/,scraping JavaScript based website,5,1,r/webscraping,https://www.reddit.com/r/webscraping/,"['selenium', 'beautifulsoup']"
https://www.reddit.com/r/datascience/comments/zy21q8/fresher_trying_to_penetrate_the_energy_x_data/,https://www.reddit.com/user/ComprehensiveTea6232/,"Fresher trying to penetrate the energy X data science market, what do you think of my resume?",5,0,r/datascience,https://www.reddit.com/r/datascience/,"['selenium', 'beautifulsoup']"
https://www.reddit.com/r/Resume/comments/zy1zbj/what_do_you_think_of_my_data_scienceoriented/,https://www.reddit.com/user/ComprehensiveTea6232/,What do you think of my data science-oriented resume ?,1,3,r/Resume,https://www.reddit.com/r/Resume/,"['selenium', 'beautifulsoup']"
https://www.reddit.com/r/learnpython/comments/zw5e1y/how_to_deal_with_loading_elements_in_selenium_and/,https://www.reddit.com/user/JRMhere/,How to deal with loading elements in selenium and beautiful soup?,2,1,r/learnpython,https://www.reddit.com/r/learnpython/,"['selenium', 'beautifulsoup']"
https://www.reddit.com/r/learnpython/comments/zuvsct/section_tag_is_missing_in_the_html_code_scraped/,https://www.reddit.com/user/Tech-Sapien18/,Section tag is missing in the html code scraped from the web using Python Selenium,1,0,r/learnpython,https://www.reddit.com/r/learnpython/,"['selenium', 'beautifulsoup']"
https://www.reddit.com/r/slavelabour/comments/zqxpzr/offeri_will_help_scrape_websites_for_data_and/,https://www.reddit.com/user/Trobis/,[OFFER]I will help scrape websites for data and python scripting.,2,0,r/slavelabour,https://www.reddit.com/r/slavelabour/,"['selenium', 'beautifulsoup']"
https://www.reddit.com/r/datascience/comments/zc26dz/online_courses_for_data_scraping_with_python/,https://www.reddit.com/user/respectedwarlock/,Online courses for Data Scraping with Python,4,2,r/datascience,https://www.reddit.com/r/datascience/,"['selenium', 'beautifulsoup']"
https://www.reddit.com/r/learnpython/comments/z8wdle/selenium_how_to_toggle_button/,,selenium how to toggle button.,4,3,r/learnpython,https://www.reddit.com/r/learnpython/,"['selenium', 'beautifulsoup']"
https://www.reddit.com/r/webscraping/comments/z7vf58/i_tried_webscraping_this_website_with_selenium/,https://www.reddit.com/user/Left4Head/,I tried webscraping this website with Selenium and BeautifulSoup but I’ve had no luck. Can anyone tell me what I’m doing wrong?,10,4,r/webscraping,https://www.reddit.com/r/webscraping/,"['selenium', 'beautifulsoup']"
https://www.reddit.com/user/Thinkitive/comments/z7qrbr/what_is_web_scraping/,https://www.reddit.com/user/Thinkitive/,What is Web Scraping?,0,1,u/Thinkitive,https://www.reddit.com/user/Thinkitive/,"['selenium', 'beautifulsoup']"
https://www.reddit.com/r/AskProgramming/comments/z76noy/scroll_down_a_lazy_loading_web_page_to_parse/,https://www.reddit.com/user/Prgrmr_in_training/,"Scroll down a ""Lazy Loading"" web page to parse historical data (Python, Selenium, BeautifulSoup4)",2,2,r/AskProgramming,https://www.reddit.com/r/AskProgramming/,"['selenium', 'beautifulsoup']"
https://www.reddit.com/r/resumes/comments/z5usyw/applying_for_data_analyst_roles_looking_for/,https://www.reddit.com/user/Raksup/,Applying for Data Analyst roles. Looking for feedback and critique.,1,4,r/resumes,https://www.reddit.com/r/resumes/,"['selenium', 'beautifulsoup']"
https://www.reddit.com/r/learnpython/comments/yw4kf1/scrapy_vs_beautifulsoup_vs_selenium/,https://www.reddit.com/user/obviously-not-a-bot/,Scrapy vs BeautifulSoup vs Selenium,1,5,r/learnpython,https://www.reddit.com/r/learnpython/,"['selenium', 'beautifulsoup']"
https://www.reddit.com/r/webscraping/comments/yvhphu/pythonselenium_pass_driverget_from_the_command/,https://www.reddit.com/user/junguler/,python/selenium pass driver.get() from the command line?,0,1,r/webscraping,https://www.reddit.com/r/webscraping/,"['selenium', 'beautifulsoup']"
https://www.reddit.com/r/learnprogramming/comments/ysxuu8/beautifulsoup_returns_partial_results_every_time/,https://www.reddit.com/user/Lurker123__/,BeautifulSoup returns partial results every time I run it,2,1,r/learnprogramming,https://www.reddit.com/r/learnprogramming/,"['selenium', 'beautifulsoup']"
https://www.reddit.com/r/scrapy/comments/ynnd66/is_it_possible_to_interact_with_pages_using_scrapy/,https://www.reddit.com/user/cepci1/,Is it possible to interact with pages using scrapy?,4,1,r/scrapy,https://www.reddit.com/r/scrapy/,"['selenium', 'beautifulsoup']"
https://www.reddit.com/r/webscraping/comments/ynna6e/which_librariesframeworks_could_be_used_for_page/,https://www.reddit.com/user/cepci1/,which libraries/frameworks could be used for page interaction?,4,2,r/webscraping,https://www.reddit.com/r/webscraping/,"['selenium', 'beautifulsoup']"
https://www.reddit.com/r/learnpython/comments/yha9nx/where_do_i_host_a_selenium_or_beautifulsoup/,https://www.reddit.com/user/911OpenUp/,Where do I host a Selenium or BeautifulSoup script that scrapes the web every night and stores the data into a database?,3,1,r/learnpython,https://www.reddit.com/r/learnpython/,"['selenium', 'beautifulsoup']"
https://www.reddit.com/r/Python/comments/ydugq9/automating_downloading_95_excel_files_with_python/,https://www.reddit.com/user/makedatauseful/,Automating downloading 95 Excel files with Python,15,396,r/Python,https://www.reddit.com/r/Python/,"['selenium', 'beautifulsoup']"
https://www.reddit.com/r/learnpython/comments/ycyusi/how_do_i_scrape_data_from_a_dynamic_website/,https://www.reddit.com/user/annoyedbird13/,How do i scrape data from a dynamic website?,18,10,r/learnpython,https://www.reddit.com/r/learnpython/,"['selenium', 'beautifulsoup']"
https://www.reddit.com/r/resumes/comments/ybxjml/resume_review_for_data_science_intern/,https://www.reddit.com/user/vile_proxima/,Resume review for Data Science Intern,3,2,r/resumes,https://www.reddit.com/r/resumes/,"['selenium', 'beautifulsoup']"
https://www.reddit.com/r/Discord_Bots/comments/yap19g/is_it_possible_to_scrape_messages_from_a_discord/,,Is it possible to scrape messages from a Discord personal chat box?,5,2,r/Discord_Bots,https://www.reddit.com/r/Discord_Bots/,"['selenium', 'beautifulsoup']"
https://www.reddit.com/r/webscraping/comments/y803kr/bs4error_on_specific_site/,https://www.reddit.com/user/Rapid1898/,BS4-error on specific site?,1,1,r/webscraping,https://www.reddit.com/r/webscraping/,"['selenium', 'beautifulsoup']"
https://www.reddit.com/r/EngineeringResumes/comments/y2ifmp/new_immigrant_looking_for_feedback_on_swe_resume/,https://www.reddit.com/user/Pok11mon/,"New immigrant looking for feedback on SWE resume, any advice is greatly appreciated",3,3,r/EngineeringResumes,https://www.reddit.com/r/EngineeringResumes/,"['selenium', 'beautifulsoup']"
https://www.reddit.com/r/slavelabour/comments/y1xim0/offeri_will_help_scrape_websites_for_data_and/,https://www.reddit.com/user/Trobis/,[OFFER]I will help scrape websites for data and python scripting.,2,4,r/slavelabour,https://www.reddit.com/r/slavelabour/,"['selenium', 'beautifulsoup']"
https://www.reddit.com/r/learnpython/comments/xwsnrt/access_sites_that_require_javascript_with/,https://www.reddit.com/user/sma92878/,"Access sites that require Javascript with ""requests"" or bypassing blockers with Selenium",2,1,r/learnpython,https://www.reddit.com/r/learnpython/,"['selenium', 'beautifulsoup']"
https://www.reddit.com/r/learnprogramming/comments/xtcg8w/problem_with_scraper_could_someone_help_me/,https://www.reddit.com/user/Hello_Every123/,Problem with scraper. Could someone help me understand the error message?,0,1,r/learnprogramming,https://www.reddit.com/r/learnprogramming/,"['selenium', 'beautifulsoup']"
https://www.reddit.com/r/resumes/comments/xoa02m/struggling_to_find_a_job_as_full_stack_developer/,https://www.reddit.com/user/pruthviisoni/,struggling to find a job as full stack developer. Let me know your thoughts.,4,1,r/resumes,https://www.reddit.com/r/resumes/,"['selenium', 'beautifulsoup']"
https://www.reddit.com/r/learnprogramming/comments/xkljwb/first_google_result_link_c/,https://www.reddit.com/user/oraudev/,First google result link C#,0,1,r/learnprogramming,https://www.reddit.com/r/learnprogramming/,"['selenium', 'beautifulsoup']"
https://www.reddit.com/r/learnpython/comments/xkb9iv/unable_to_extract_element_with_requests_and/,https://www.reddit.com/user/Vast_Manufacturer811/,Unable to extract element with requests and beautifulsoup,1,1,r/learnpython,https://www.reddit.com/r/learnpython/,"['selenium', 'beautifulsoup']"
https://www.reddit.com/r/learnpython/comments/xiyz3u/trouble_with_webscraping_and_javascript_on_website/,https://www.reddit.com/user/Chris_B123/,Trouble with webscraping and javascript on website,2,1,r/learnpython,https://www.reddit.com/r/learnpython/,"['selenium', 'beautifulsoup']"
https://www.reddit.com/r/learnpython/comments/xfv2zy/need_help_downloading_pdf_from_unconventional_url/,https://www.reddit.com/user/sendnukes23/,Need help downloading PDF from unconventional (?) URL,1,1,r/learnpython,https://www.reddit.com/r/learnpython/,"['selenium', 'beautifulsoup']"
https://www.reddit.com/r/slavelabour/comments/xd1s31/offeri_will_help_scrape_websites_for_data_and/,https://www.reddit.com/user/Trobis/,[OFFER]I will help scrape websites for data and python scripting.,2,1,r/slavelabour,https://www.reddit.com/r/slavelabour/,"['selenium', 'beautifulsoup']"
https://www.reddit.com/r/slavelabour/comments/x5kn8n/offeri_will_help_scrape_websites_for_data_and/,https://www.reddit.com/user/Trobis/,[OFFER]I will help scrape websites for data and python scripting.,1,1,r/slavelabour,https://www.reddit.com/r/slavelabour/,"['selenium', 'beautifulsoup']"
https://www.reddit.com/r/learnpython/comments/x3d3px/im_embarrassed_of_my_code/,https://www.reddit.com/user/thrussie/,I’m embarrassed of my code,11,1,r/learnpython,https://www.reddit.com/r/learnpython/,"['selenium', 'beautifulsoup']"
https://www.reddit.com/r/discgolf/comments/x1y6c3/a_simple_simulation_to_predict_worlds_winner/,https://www.reddit.com/user/AutomaticMaterial313/,A simple simulation to predict World's winner,7,14,r/discgolf,https://www.reddit.com/r/discgolf/,"['selenium', 'beautifulsoup']"
https://www.reddit.com/r/PythonJobs/comments/wxmibd/python_developer_at_your_services/,https://www.reddit.com/user/WilfredM94/,Python developer at your services,1,1,r/PythonJobs,https://www.reddit.com/r/PythonJobs/,"['selenium', 'beautifulsoup']"
https://www.reddit.com/r/slavelabour/comments/wtrzvs/offeri_will_help_scrape_websites_for_data_and/,https://www.reddit.com/user/Trobis/,[OFFER]I will help scrape websites for data and python scripting.,1,2,r/slavelabour,https://www.reddit.com/r/slavelabour/,"['selenium', 'beautifulsoup']"
https://www.reddit.com/user/Actowiz-solutions/comments/wpqg0q/how_to_extract_monkeypox_data_by_using_web/,https://www.reddit.com/user/Actowiz-solutions/,How to Extract Monkeypox Data By Using Web Scraping & Pandas?,0,1,u/Actowiz-solutions,https://www.reddit.com/user/Actowiz-solutions/,"['selenium', 'beautifulsoup']"
https://www.reddit.com/r/webdev/comments/wpq0ho/studying_data_science_asking_for_advice_on/,,"Studying Data Science: Asking for advice on permissions, necessary keys/certificates, etc. on scraping data from someone who develops websites with databases.",1,0,r/webdev,https://www.reddit.com/r/webdev/,"['selenium', 'beautifulsoup']"
https://www.reddit.com/r/Resume/comments/wn3wc0/review_request_junior_software_developer_qa_or/,https://www.reddit.com/user/bytesizedinquiries/,"Review Request - Junior Software Developer, QA or Tech Support Engineer; Skills section modified based on position",4,3,r/Resume,https://www.reddit.com/r/Resume/,"['selenium', 'beautifulsoup']"
https://www.reddit.com/r/learnpython/comments/wlixoy/set_a_class_method_as_an_init_variable/,https://www.reddit.com/user/tdonov/,Set a class method as an __init__ variable,4,2,r/learnpython,https://www.reddit.com/r/learnpython/,"['selenium', 'beautifulsoup']"
https://www.reddit.com/r/Python/comments/wkdmf1/i_made_a_hackernoon_web_scraper_with_selenium_and/,https://www.reddit.com/user/_fleri/,"I made a Hackernoon web scraper with Selenium, and deployed as a cron job without dealing with infrastructure",2,1,r/Python,https://www.reddit.com/r/Python/,"['selenium', 'beautifulsoup']"
https://www.reddit.com/r/learnpython/comments/wh0tca/trouble_when_choosing_python_web_scraping_tool_or/,https://www.reddit.com/user/tys203831/,Trouble when choosing Python web scraping tool or library?,2,0,r/learnpython,https://www.reddit.com/r/learnpython/,"['selenium', 'beautifulsoup']"
https://www.reddit.com/r/webscraping/comments/wd5zce/scraping_links_from_a_forum/,https://www.reddit.com/user/rab5374/,Scraping links from a forum,3,3,r/webscraping,https://www.reddit.com/r/webscraping/,"['selenium', 'beautifulsoup']"
https://www.reddit.com/r/learnpython/comments/wcm25z/rewriting_code_with_classes/,https://www.reddit.com/user/tdonov/,Rewriting code with classes,3,0,r/learnpython,https://www.reddit.com/r/learnpython/,"['selenium', 'beautifulsoup']"
