post_url,author,post_title,comments,upvotes,subreddit_name,subreddit_link,search_terms
https://www.reddit.com/r/learnprogramming/comments/172zsmo/web_scraper_only_prints_one_result/,https://www.reddit.com/user/psychedlik/,Web Scraper only prints one result,1,1,r/learnprogramming,https://www.reddit.com/r/learnprogramming/,"['selenium', 'beautifulsoup']"
https://www.reddit.com/r/SaaS/comments/172i8zs/building_my_first_saas_a_platform_for_convention/,https://www.reddit.com/user/wheelyboi2000/,Building my first SaaS: A Platform for Convention Vendors to be more efficient. Thoughts?,0,1,r/SaaS,https://www.reddit.com/r/SaaS/,"['selenium', 'beautifulsoup']"
https://www.reddit.com/r/slavelabour/comments/16yw6wm/offershopify_theme_development_and_web_scraping/,https://www.reddit.com/user/Trobis/,[OFFER]Shopify Theme Development and web scraping and python scripting.,3,1,r/slavelabour,https://www.reddit.com/r/slavelabour/,"['selenium', 'beautifulsoup']"
https://www.reddit.com/r/webscraping/comments/16we8mq/ideas_on_gathering_team_urls_from_unique_webpages/,https://www.reddit.com/user/fenechio/,Ideas on Gathering Team URLs from Unique Webpages,4,1,r/webscraping,https://www.reddit.com/r/webscraping/,"['selenium', 'beautifulsoup']"
https://www.reddit.com/r/Heroku/comments/16uuama/trying_to_deploy_selenium_helium_python_script_on/,https://www.reddit.com/user/elpad92/,Trying to deploy selenium Helium python script on Heroku,1,1,r/Heroku,https://www.reddit.com/r/Heroku/,"['selenium', 'beautifulsoup']"
https://www.reddit.com/user/mobileapp13/comments/16thtp0/unveiling_the_symphony_of_data_music_mobile_app/,https://www.reddit.com/user/mobileapp13/,Unveiling the Symphony of Data: Music Mobile App Data Scraping for Insights,0,1,u/mobileapp13,https://www.reddit.com/user/mobileapp13/,"['selenium', 'beautifulsoup']"
https://www.reddit.com/r/resumes/comments/16rvb33/its_been_3_months_only_1_interview_what_am_i/,https://www.reddit.com/user/tegridypatato/,It's been 3 months only 1 interview. What am I doing wrong.,8,2,r/resumes,https://www.reddit.com/r/resumes/,"['selenium', 'beautifulsoup']"
https://www.reddit.com/r/programminghelp/comments/16r7ouj/help_with_getting_around_cloudfare/,https://www.reddit.com/user/darkswirlz/,Help with getting around cloudfare,1,0,r/programminghelp,https://www.reddit.com/r/programminghelp/,"['selenium', 'beautifulsoup']"
https://www.reddit.com/r/resumes/comments/16r0e2x/cs_major_junior_looking_for_summer_internships/,https://www.reddit.com/user/paneer_naan/,CS Major Junior looking for Summer Internships,1,3,r/resumes,https://www.reddit.com/r/resumes/,"['selenium', 'beautifulsoup']"
https://www.reddit.com/r/slavelabour/comments/16qdv3q/offeri_will_help_scrape_websites_for_data_and/,https://www.reddit.com/user/Trobis/,[OFFER]I will help scrape websites for data and python scripting.,2,1,r/slavelabour,https://www.reddit.com/r/slavelabour/,"['selenium', 'beautifulsoup']"
https://www.reddit.com/user/Elegant_Medicine4394/comments/16p91ip/scraping_grocery_data_from_mobile_apps_using/,https://www.reddit.com/user/Elegant_Medicine4394/,Scraping Grocery Data from Mobile Apps Using Python: A Comprehensive Guide,0,1,u/Elegant_Medicine4394,https://www.reddit.com/user/Elegant_Medicine4394/,"['selenium', 'beautifulsoup']"
https://www.reddit.com/r/learnpython/comments/16ouqve/web_scrapping_using_python/,https://www.reddit.com/user/No-Assist-8110/,Web scrapping using python,0,1,r/learnpython,https://www.reddit.com/r/learnpython/,"['selenium', 'beautifulsoup']"
https://www.reddit.com/r/webscraping/comments/16offqp/setting_seleniumbase_driver_options/,https://www.reddit.com/user/Content-Apple-833/,Setting SeleniumBase Driver options,5,1,r/webscraping,https://www.reddit.com/r/webscraping/,"['selenium', 'beautifulsoup']"
https://www.reddit.com/r/resumes/comments/16nrlyj/phd_biochemistbioinformatics_looking_to_break/,https://www.reddit.com/user/data_is_my_fetish/,PhD Biochemist(bioinformatics) looking to break into Data Science - resume advice,4,1,r/resumes,https://www.reddit.com/r/resumes/,"['selenium', 'beautifulsoup']"
https://www.reddit.com/user/ForceAccomplished257/comments/16netnf/how_to_scrape_data_from_food_delivery_app_burger/,https://www.reddit.com/user/ForceAccomplished257/,How to Scrape Data from Food Delivery App Burger King – Spain?,0,1,u/ForceAccomplished257,https://www.reddit.com/user/ForceAccomplished257/,"['selenium', 'beautifulsoup']"
https://www.reddit.com/r/slavelabour/comments/16mu3tf/offeri_will_help_scrape_websites_for_data_and/,https://www.reddit.com/user/Trobis/,[OFFER]I will help scrape websites for data and python scripting.,3,1,r/slavelabour,https://www.reddit.com/r/slavelabour/,"['selenium', 'beautifulsoup']"
https://www.reddit.com/r/developersIndia/comments/16j6bko/help_needed_for_web_scraping/,https://www.reddit.com/user/G_S_7_wiz/,Help needed for Web Scraping,2,1,r/developersIndia,https://www.reddit.com/r/developersIndia/,"['selenium', 'beautifulsoup']"
https://www.reddit.com/r/Python/comments/16j68qx/web_scraping/,https://www.reddit.com/user/G_S_7_wiz/,Web Scraping,39,35,r/Python,https://www.reddit.com/r/Python/,"['selenium', 'beautifulsoup']"
https://www.reddit.com/r/learnpython/comments/16imc97/trying_to_click_a_button_with_selenium_but_really/,https://www.reddit.com/user/Faultylntelligence/,Trying to click a button with Selenium but really struggling,7,1,r/learnpython,https://www.reddit.com/r/learnpython/,"['selenium', 'beautifulsoup']"
https://www.reddit.com/r/SeleniumPython/comments/16arsmc/basic_question_about_selenium_python_and/,https://www.reddit.com/user/TileJam209/,"Basic Question about Selenium, Python, and Webscraping",1,2,r/SeleniumPython,https://www.reddit.com/r/SeleniumPython/,"['selenium', 'beautifulsoup']"
https://www.reddit.com/r/learnpython/comments/167l424/cant_get_my_webscraping_code_to_work/,https://www.reddit.com/user/Best_Case7758/,Can't get my webscraping code to work,7,1,r/learnpython,https://www.reddit.com/r/learnpython/,"['selenium', 'beautifulsoup']"
https://www.reddit.com/r/learnpython/comments/166mvdg/web_scraping/,https://www.reddit.com/user/TorroesPrime/,web scraping,3,5,r/learnpython,https://www.reddit.com/r/learnpython/,"['selenium', 'beautifulsoup']"
https://www.reddit.com/r/webscraping/comments/1663qu9/struggling_the_chrome_extension_for_webscrapin/,https://www.reddit.com/user/whygamoralad/,Struggling the chrome extension for webscrapin,0,1,r/webscraping,https://www.reddit.com/r/webscraping/,"['selenium', 'beautifulsoup']"
https://www.reddit.com/user/productdatascrape/comments/163dhv4/how_to_scrape_amazon_best_seller_lists_with/,https://www.reddit.com/user/productdatascrape/,How to Scrape Amazon Best Seller Lists with Python and BeautifulSoup?,0,1,u/productdatascrape,https://www.reddit.com/user/productdatascrape/,"['selenium', 'beautifulsoup']"
https://www.reddit.com/r/learnprogramming/comments/15z302z/i_have_been_learning_c_in_an_institution_and/,https://www.reddit.com/user/magnumXZ/,I have been learning C in an institution and Python by myself for a while. Where should I focus now to get into back end and/or web scraping?,1,2,r/learnprogramming,https://www.reddit.com/r/learnprogramming/,"['selenium', 'beautifulsoup']"
https://www.reddit.com/r/learnpython/comments/15yzkw7/can_you_help_me_with_this_selenium_web_scrape/,https://www.reddit.com/user/learnwithscholar/,Can you help me with this Selenium web scrape problem in Python?,1,1,r/learnpython,https://www.reddit.com/r/learnpython/,"['selenium', 'beautifulsoup']"
https://www.reddit.com/r/resumes/comments/15txxl8/trying_to_get_a_job_in_eu_from_africa/,https://www.reddit.com/user/Electronic_Plant9697/,Trying to get a job in EU from Africa,1,1,r/resumes,https://www.reddit.com/r/resumes/,"['selenium', 'beautifulsoup']"
https://www.reddit.com/r/learnpython/comments/15sgvgs/how_to_remove_do_you_mean_from_google/,https://www.reddit.com/user/Designer-Ad-3462/,"How to remove ""Do you mean"" from google",12,0,r/learnpython,https://www.reddit.com/r/learnpython/,"['selenium', 'beautifulsoup']"
https://www.reddit.com/r/learnpython/comments/15ml5xy/can_selenium_webdriver_program_work_without_the/,https://www.reddit.com/user/RuthlessDaoist/,Can selenium webdriver program work without the browser installed?,13,2,r/learnpython,https://www.reddit.com/r/learnpython/,"['selenium', 'beautifulsoup']"
https://www.reddit.com/r/webscraping/comments/15mjn6g/get_the_whole_html_rendered_on_the_site_by/,https://www.reddit.com/user/harerp/,Get the whole html rendered on the site by client-side javascript,0,1,r/webscraping,https://www.reddit.com/r/webscraping/,"['selenium', 'beautifulsoup']"
https://www.reddit.com/r/resumes/comments/15l3cu3/looking_to_switch_jobs_as_my_current_one_is/,https://www.reddit.com/user/tim39971/,Looking to switch jobs as my current one is giving the support I need to further my career. Can't seem to get much response from my resumes I've sent out. Any tips/feedback appreciated!,2,1,r/resumes,https://www.reddit.com/r/resumes/,"['selenium', 'beautifulsoup']"
https://www.reddit.com/r/webscraping/comments/15jhqyq/selenium_vs_beautiful_soup/,https://www.reddit.com/user/yevo_/,Selenium vs beautiful soup,9,1,r/webscraping,https://www.reddit.com/r/webscraping/,"['selenium', 'beautifulsoup']"
https://www.reddit.com/r/webscraping/comments/15h5by4/beautifulsoup_vs_selenium/,https://www.reddit.com/user/shabbyporpoise/,BeautifulSoup vs Selenium,26,4,r/webscraping,https://www.reddit.com/r/webscraping/,"['selenium', 'beautifulsoup']"
https://www.reddit.com/r/webscraping/comments/15f3w34/question_while_scraping_a_table/,https://www.reddit.com/user/Quiet-Orange6476/,Question while scraping a table,6,3,r/webscraping,https://www.reddit.com/r/webscraping/,"['selenium', 'beautifulsoup']"
https://www.reddit.com/r/slavelabour/comments/15dnqla/offershopify_theme_development_and_web_scraping/,https://www.reddit.com/user/Trobis/,[OFFER]Shopify Theme Development and web scraping and python scripting.,2,2,r/slavelabour,https://www.reddit.com/r/slavelabour/,"['selenium', 'beautifulsoup']"
https://www.reddit.com/r/slavelabour/comments/15a1b19/offershopify_theme_development_and_web_scraping/,https://www.reddit.com/user/Trobis/,[OFFER]Shopify Theme Development and web scraping and python scripting.,1,1,r/slavelabour,https://www.reddit.com/r/slavelabour/,"['selenium', 'beautifulsoup']"
https://www.reddit.com/r/webscraping/comments/1581te9/scraping_google_seems_trickier_than_most_sites/,https://www.reddit.com/user/SuckMyHiney/,"Scraping Google seems trickier than most sites. Can it be done, and is it worth considering using Fiverr?",13,3,r/webscraping,https://www.reddit.com/r/webscraping/,"['selenium', 'beautifulsoup']"
https://www.reddit.com/r/resumes/comments/157lgnp/even_rejected_by_an_unpaid_internship/,https://www.reddit.com/user/Uranki098/,Even rejected by an unpaid internship,51,82,r/resumes,https://www.reddit.com/r/resumes/,"['selenium', 'beautifulsoup']"
https://www.reddit.com/user/Alice06wilson/comments/154i116/the_top_free_web_scraping_tools_for_effective/,https://www.reddit.com/user/Alice06wilson/,The Top Free Web Scraping Tools for Effective Data Extraction,0,1,u/Alice06wilson,https://www.reddit.com/user/Alice06wilson/,"['selenium', 'beautifulsoup']"
https://www.reddit.com/user/actowiz/comments/153rru0/scrape_popular_retailer_data_scrape_data_from_any/,https://www.reddit.com/user/actowiz/,Scrape Popular Retailer data - Scrape Data From Any Ecommerce Website,0,1,u/actowiz,https://www.reddit.com/user/actowiz/,"['selenium', 'beautifulsoup']"
https://www.reddit.com/r/learnpython/comments/152zvis/ho_do_i_rank_instagram_reels_from_most_to_last/,https://www.reddit.com/user/RPI_Design/,Ho do I rank Instagram Reels from most to last viewed?,5,0,r/learnpython,https://www.reddit.com/r/learnpython/,"['selenium', 'beautifulsoup']"
https://www.reddit.com/r/slavelabour/comments/152d5rf/offershopify_theme_development_and_web_scraping/,https://www.reddit.com/user/Trobis/,[OFFER]Shopify Theme Development and web scraping and python scripting.,1,1,r/slavelabour,https://www.reddit.com/r/slavelabour/,"['selenium', 'beautifulsoup']"
https://www.reddit.com/r/ProgramadoresBrasil/comments/1528q8i/poderiam_me_ajudar_em_um_scrapy/,https://www.reddit.com/user/Disastrous_Age_390/,poderiam me ajudar em um Scrapy ?,0,2,r/ProgramadoresBrasil,https://www.reddit.com/r/ProgramadoresBrasil/,"['selenium', 'beautifulsoup']"
https://www.reddit.com/r/LocalLLaMA/comments/151sm9m/any_wip_or_available_projects_for_web_plugins_for/,https://www.reddit.com/user/card_chase/,Any WIP or available projects for web plugins for models like WizardCoder? (I searched),3,2,r/LocalLLaMA,https://www.reddit.com/r/LocalLLaMA/,"['selenium', 'beautifulsoup']"
https://www.reddit.com/r/webscraping/comments/150doiw/learning_web_scraping/,https://www.reddit.com/user/Fit-Salad-5977/,Learning Web scraping,17,10,r/webscraping,https://www.reddit.com/r/webscraping/,"['selenium', 'beautifulsoup']"
https://www.reddit.com/r/webscraping/comments/14ztaja/avoid_bot_detection/,https://www.reddit.com/user/Teemo20102001/,Avoid bot detection,7,2,r/webscraping,https://www.reddit.com/r/webscraping/,"['selenium', 'beautifulsoup']"
https://www.reddit.com/r/learnprogramming/comments/14zhfj4/selenium_and_beautifulsoup/,https://www.reddit.com/user/juicylemonpeels/,Selenium and BeautifulSoup?,3,1,r/learnprogramming,https://www.reddit.com/r/learnprogramming/,"['selenium', 'beautifulsoup']"
https://www.reddit.com/r/resumes/comments/14x9t5y/please_any_feedback_will_be_appreciated_500/,https://www.reddit.com/user/EthicalArtisan/,Please any feedback will be appreciated. 500+ applications sent I have not gotten a single interview for a junior data analyst position.,1,1,r/resumes,https://www.reddit.com/r/resumes/,"['selenium', 'beautifulsoup']"
https://www.reddit.com/r/slavelabour/comments/14w2y7w/offershopify_theme_development_and_web_scraping/,https://www.reddit.com/user/Trobis/,[OFFER]Shopify Theme Development and web scraping and python scripting.,1,1,r/slavelabour,https://www.reddit.com/r/slavelabour/,"['selenium', 'beautifulsoup']"
https://www.reddit.com/r/resumes/comments/14uuyjc/created_my_resume_and_applied_for_some/,https://www.reddit.com/user/fazeelayaz/,"Created my resume and applied for some internships but a lot of rejections. I'm losing confidence in my resume, can someone please help me out?",10,1,r/resumes,https://www.reddit.com/r/resumes/,"['selenium', 'beautifulsoup']"
https://www.reddit.com/r/slavelabour/comments/14rj1ym/offershopify_theme_development_and_web_scraping/,https://www.reddit.com/user/Trobis/,[OFFER]Shopify Theme Development and web scraping and python scripting.,4,4,r/slavelabour,https://www.reddit.com/r/slavelabour/,"['selenium', 'beautifulsoup']"
https://www.reddit.com/user/HungryLawfulness6781/comments/14qji3l/a_little_help_here_can_someone_check_and_provide/,https://www.reddit.com/user/HungryLawfulness6781/,"A little help here, can someone check and provide feedback for any flaws that you might notice I have currently applied to over 50 jobs for process automation or software development positions most of them having an accompanied cover letter, but aren't getting any responses except from scammers .",0,1,u/HungryLawfulness6781,https://www.reddit.com/user/HungryLawfulness6781/,"['selenium', 'beautifulsoup']"
https://www.reddit.com/r/webscraping/comments/14ldo3c/scraping_fotocasa_with_selenium_and_playwright/,https://www.reddit.com/user/dooolittle/,Scraping Fotocasa with Selenium and Playwright - can you help to debug?,1,1,r/webscraping,https://www.reddit.com/r/webscraping/,"['selenium', 'beautifulsoup']"
https://www.reddit.com/r/webscraping/comments/14jptlz/best_way_to_scrape_js_files/,https://www.reddit.com/user/themasterofbation/,Best way to scrape JS files?,3,1,r/webscraping,https://www.reddit.com/r/webscraping/,"['selenium', 'beautifulsoup']"
https://www.reddit.com/r/pythonmodules/comments/14iu1oh/help_me_make_a_list_of_widely_used_python_3/,https://www.reddit.com/user/jer_re_code/,Help me make a list of widely used python 3 modules. 📃😉,0,1,r/pythonmodules,https://www.reddit.com/r/pythonmodules/,"['selenium', 'beautifulsoup']"
https://www.reddit.com/r/webscraping/comments/14iq01w/i_am_trying_to_scrape_this_website_however_i_keep/,https://www.reddit.com/user/iiztrollin/,"I am trying to scrape this website, however I keep running into the same error were the script only pastes the parcelID into my google sheets columns.",2,2,r/webscraping,https://www.reddit.com/r/webscraping/,"['selenium', 'beautifulsoup']"
https://www.reddit.com/r/ChatGPT/comments/14ghz9w/automate_formfilling_with_ai/,https://www.reddit.com/user/Zaki_1052_/,Automate Form-Filling with AI,4,2,r/ChatGPT,https://www.reddit.com/r/ChatGPT/,"['selenium', 'beautifulsoup']"
https://www.reddit.com/r/slavelabour/comments/14dafks/offershopify_theme_development_and_web_scraping/,https://www.reddit.com/user/Trobis/,[OFFER]Shopify Theme Development and web scraping and python scripting.,1,1,r/slavelabour,https://www.reddit.com/r/slavelabour/,"['selenium', 'beautifulsoup']"
https://www.reddit.com/user/acto-wiz/comments/14a102x/scrape_popular_retailer_data_scrape_data_from_any/,https://www.reddit.com/user/acto-wiz/,Scrape Popular Retailer data – Scrape Data From Any Ecommerce Website,0,1,u/acto-wiz,https://www.reddit.com/user/acto-wiz/,"['selenium', 'beautifulsoup']"
https://www.reddit.com/user/actowiz/comments/1498ezf/scrape_popular_retailer_data_scrape_data_from_any/,https://www.reddit.com/user/actowiz/,Scrape Popular Retailer data – Scrape Data From Any Ecommerce Website,0,1,u/actowiz,https://www.reddit.com/user/actowiz/,"['selenium', 'beautifulsoup']"
https://www.reddit.com/r/learnpython/comments/148sin8/automatically_add_items_to_your_big_cartel_cart/,https://www.reddit.com/user/stitchface66/,Automatically add items to your Big Cartel cart with Python.,0,4,r/learnpython,https://www.reddit.com/r/learnpython/,"['selenium', 'beautifulsoup']"
https://www.reddit.com/r/madeinpython/comments/148o900/automatically_add_items_to_your_big_cartel_cart/,https://www.reddit.com/user/stitchface66/,Automatically add items to your Big Cartel cart with Python.,1,4,r/madeinpython,https://www.reddit.com/r/madeinpython/,"['selenium', 'beautifulsoup']"
https://www.reddit.com/r/resumes/comments/147jkfk/be_gentle_computer_science_student_2_resumesone/,https://www.reddit.com/user/TellMePeople/,"Be gentle, Computer science student, 2 resumes(one for python one for web dev)",8,1,r/resumes,https://www.reddit.com/r/resumes/,"['selenium', 'beautifulsoup']"
https://www.reddit.com/r/pythontips/comments/146udmb/python_community_lets_dive_into_the_exciting/,https://www.reddit.com/user/add-code/,Python Community: Let's Dive Into the Exciting World of Web Scraping,2,28,r/pythontips,https://www.reddit.com/r/pythontips/,"['selenium', 'beautifulsoup']"
https://www.reddit.com/r/coder_corner/comments/146s8pw/python_community_lets_dive_into_the_exciting/,https://www.reddit.com/user/add-code/,Python Community: Let's Dive Into the Exciting World of Web Scraping!,0,3,r/coder_corner,https://www.reddit.com/r/coder_corner/,"['selenium', 'beautifulsoup']"
https://www.reddit.com/r/whatsapp/comments/143235j/do_you_want_to_install_whatsapp_desktop_without/,https://www.reddit.com/user/DeadlyCarpincho/,Do you want to install WhatsApp Desktop without Microsoft Store on Windows? I have created a Python application for that.,2,3,r/whatsapp,https://www.reddit.com/r/whatsapp/,"['selenium', 'beautifulsoup']"
https://www.reddit.com/r/learnpython/comments/141nexb/driver_webdriverchrome_issues_with_a_selenium/,https://www.reddit.com/user/saint_leonard/,driver = webdriver.Chrome() :: issues with a selenium approach - how to work around,4,1,r/learnpython,https://www.reddit.com/r/learnpython/,"['selenium', 'beautifulsoup']"
https://www.reddit.com/r/Oxylabs/comments/141dmdp/how_do_i_scrape_images_with_python/,,How do I scrape images with Python?,0,3,r/Oxylabs,https://www.reddit.com/r/Oxylabs/,"['selenium', 'beautifulsoup']"
https://www.reddit.com/r/slavelabour/comments/140e4b7/offershopify_theme_development_and_web_scraping/,https://www.reddit.com/user/Trobis/,[OFFER]Shopify Theme Development and web scraping and python scripting.,1,1,r/slavelabour,https://www.reddit.com/r/slavelabour/,"['selenium', 'beautifulsoup']"
https://www.reddit.com/r/bjj/comments/13xpaeh/python_script_that_checks_the_daily_deals_on/,https://www.reddit.com/user/PlusRise/,Python script that checks the daily deals on BJJFanatics,51,96,r/bjj,https://www.reddit.com/r/bjj/,"['selenium', 'beautifulsoup']"
https://www.reddit.com/r/learnpython/comments/13vzsfg/modulenotfounderror/,https://www.reddit.com/user/BigBadBoy1003/,Modulenotfounderror,2,0,r/learnpython,https://www.reddit.com/r/learnpython/,"['selenium', 'beautifulsoup']"
https://www.reddit.com/r/selenium/comments/13tx468/how_to_enumerate_the_fields_in_and_populate_a_form/,https://www.reddit.com/user/jsalsman/,"How to enumerate the fields in, and populate a form?",2,1,r/selenium,https://www.reddit.com/r/selenium/,"['selenium', 'beautifulsoup']"
https://www.reddit.com/user/svfhrgqgc53zgbrh86/comments/13pi2f1/crawlera_list_unlocking_your_data_crawling/,https://www.reddit.com/user/svfhrgqgc53zgbrh86/,Crawlera List: Unlocking Your Data Crawling Potential,0,1,u/svfhrgqgc53zgbrh86,https://www.reddit.com/user/svfhrgqgc53zgbrh86/,"['selenium', 'beautifulsoup']"
https://www.reddit.com/r/learnpython/comments/13pdzyp/problem_with_python_web_scraping/,https://www.reddit.com/user/legendarypegasus/,Problem with python web scraping,2,1,r/learnpython,https://www.reddit.com/r/learnpython/,"['selenium', 'beautifulsoup']"
https://www.reddit.com/r/slavelabour/comments/13krmky/offershopify_theme_development_and_web_scraping/,https://www.reddit.com/user/Trobis/,[OFFER]Shopify Theme Development and web scraping and python scripting.,1,3,r/slavelabour,https://www.reddit.com/r/slavelabour/,"['selenium', 'beautifulsoup']"
https://www.reddit.com/r/learnprogramming/comments/13fgbaz/i_tried_to_keep_track_of_flight_prices_from_the/,https://www.reddit.com/user/Technical-Bee-9999/,"I tried to keep track of flight prices from the site ""skyscanner.net"" (just as a personal project, no commercial intentions) but can't get the right html with BeautifulSoup and even Selenium raises an error after a while. Are these defense mechanism from the site?",1,3,r/learnprogramming,https://www.reddit.com/r/learnprogramming/,"['selenium', 'beautifulsoup']"
https://www.reddit.com/r/webscraping/comments/13boqtw/webscraping_beginner_here_ready_to_start_leveling/,https://www.reddit.com/user/srs328/,"Webscraping beginner here ready to start leveling up to intermediate. Looking for some good webscraping repositories (e.g any of your GitHub repos/projects) that I can use as learning tools, and general recommendations for what to do next",5,1,r/webscraping,https://www.reddit.com/r/webscraping/,"['selenium', 'beautifulsoup']"
https://www.reddit.com/r/learnpython/comments/137x9pi/whats_wrong_with_my_in_stock_notification_code/,https://www.reddit.com/user/pauljohn92/,What's wrong with my in stock notification code? :(,5,0,r/learnpython,https://www.reddit.com/r/learnpython/,"['selenium', 'beautifulsoup']"
https://www.reddit.com/r/webscraping/comments/134xd64/web_scraping_and_data_visualization_project_for/,https://www.reddit.com/user/Trilobyteme/,Web Scraping and Data Visualization Project for Arctic Environmental History,7,3,r/webscraping,https://www.reddit.com/r/webscraping/,"['selenium', 'beautifulsoup']"
https://www.reddit.com/r/slavelabour/comments/134hp6y/offershopify_theme_development_and_web_scraping/,https://www.reddit.com/user/Trobis/,[OFFER]Shopify Theme Development and web scraping and python scripting.,3,2,r/slavelabour,https://www.reddit.com/r/slavelabour/,"['selenium', 'beautifulsoup']"
https://www.reddit.com/r/resumes/comments/130njja/is_there_a_way_this_data_analyst_resume_can_be/,https://www.reddit.com/user/nozdzica/,"Is there a way this data analyst resume can be improved? Applied a lot of tips from this subreddit, would appreciate some feedback after improvements.",3,2,r/resumes,https://www.reddit.com/r/resumes/,"['selenium', 'beautifulsoup']"
https://www.reddit.com/r/webscraping/comments/12z34rg/price_scraping_from_home_depot_help_help_help/,https://www.reddit.com/user/EmergencyTitle943/,Price scraping from Home Depot help help help,5,0,r/webscraping,https://www.reddit.com/r/webscraping/,"['selenium', 'beautifulsoup']"
https://www.reddit.com/r/programacao/comments/12ycu3n/ajuda_web_scraping_para_achar_url/,https://www.reddit.com/user/WolverineMiddle5976/,Ajuda web scraping para achar URL,6,0,r/programacao,https://www.reddit.com/r/programacao/,"['selenium', 'beautifulsoup']"
https://www.reddit.com/user/Sure-Series8740/comments/12x67pc/a_simple_guide_to_scraping_static_and_dynamic/,https://www.reddit.com/user/Sure-Series8740/,A Simple Guide to Scraping Static and Dynamic Websites with Python,0,1,u/Sure-Series8740,https://www.reddit.com/user/Sure-Series8740/,"['selenium', 'beautifulsoup']"
https://www.reddit.com/r/cscareerquestions/comments/12oa9e0/would_a_1_year_programming_certificate_course/,https://www.reddit.com/user/hands0m3dude/,Would a 1 year programming certificate course help me get a job in Canada?,11,1,r/cscareerquestions,https://www.reddit.com/r/cscareerquestions/,"['selenium', 'beautifulsoup']"
https://www.reddit.com/user/actowiz/comments/12lxck6/exploratory_data_analysis_of_housing_rental/,https://www.reddit.com/user/actowiz/,Exploratory Data Analysis of Housing Rental Market in Germany with Python,0,1,u/actowiz,https://www.reddit.com/user/actowiz/,"['selenium', 'beautifulsoup']"
